{
  "$schema": "http://json-schema.org/draft-07/schema#",
  "$id": "https://earnie.local/backtesting_scenarios.schema.json",
  "title": "Earnie Backtesting-Szenarien",
  "description": "Szenarien für Szenario-Explorer und Live-Betrieb (live_scenario_id in config.json).",
  "type": "object",
  "required": [
    "scenarios"
  ],
  "properties": {
    "$schema": {
      "type": "string",
      "description": "Verweis auf diese Schema-Datei für Editor-Hilfen."
    },
    "cbc_gap_rel": {
      "type": "number",
      "exclusiveMinimum": 0,
      "exclusiveMaximum": 1,
      "description": "Relativer CBC-MIP-Gap für Backtesting (z. B. 0.10 = 10 %). Fehlt der Wert, gilt 10 %."
    },
    "commit_hours": {
      "type": "integer",
      "minimum": 1,
      "description": "MILP commit-K für Szenario-Explorer/Backtesting: alle N Stunden neu lösen (1 = stündliches Re-Opt; Fensterlänge z. B. 24 = open-loop). Fehlt der Wert, gilt 24."
    },
    "cbc_strict_time_limit_sec": {
      "type": "number",
      "minimum": 0,
      "description": "Sekunden für Strict-CBC vor gapRel-Fallback (0 = Strict überspringen). Standard: 3."
    },
    "milp_solver": {
      "type": "string",
      "enum": ["cbc", "highs"],
      "description": "MILP-Backend für Szenario-Explorer/Backtesting (highs Standard; cbc Fallback). Env EARNIE_MILP_SOLVER hat Vorrang."
    },
    "disable_horizon_soc_anchor": {
      "type": "boolean",
      "description": "Trial: keine harte End-SoC-/Sonnenaufgangs-SOC_min-Gleichheit (nur min/max). Standard false."
    },
    "scenarios": {
      "type": "array",
      "description": "Alle Szenarien inkl. Live-Baseline (Standard-ID: live, gewählt via live_scenario_id).",
      "items": {
        "$ref": "#/definitions/scenario"
      }
    },
    "earnie_data_model": {
      "type": "integer",
      "const": 5,
      "description": "Earnie data-model version for config pack import/export."
    }
  },
  "definitions": {
    "scenario": {
      "type": "object",
      "description": "Benanntes Szenario für Simulation/Backtesting.",
      "required": [
        "id",
        "label",
        "settings"
      ],
      "properties": {
        "id": {
          "type": "string",
          "description": "Eindeutige Szenario-Kennung (z. B. live, battery_10kwh)."
        },
        "label": {
          "type": "string",
          "description": "Anzeigename in der UI."
        },
        "enabled": {
          "type": "boolean",
          "description": "Wenn false, wird das Szenario im Szenario-Explorer nicht berechnet. Standard true wenn fehlend."
        },
        "own_reference": {
          "type": "boolean",
          "description": "Wenn true: eigene Nicht-Opt-Referenz. Wenn false: Live-Ref/Historisch teilen. Fehlt: Auto (Tarif+pv_kwp-Heuristik)."
        },
        "settings": {
          "type": "object",
          "description": "Parameter-Override (flache Felder oder Referenzen auf Entitäten). Standort/Zeitzone kommen aus dem Hausprofil (house_profile_id), nicht aus settings.",
          "additionalProperties": true,
          "properties": {
            "battery_ids": {
              "type": "array",
              "description": "Referenzen auf batteries[].id in components.json (Mehrfach-Auswahl, 2.7.c).",
              "items": {
                "type": "string"
              }
            },
            "battery_id": {
              "type": "string",
              "description": "Removed in earnie_data_model 4 — use battery_ids[].",
              "not": {}
            },
            "pv_system_ids": {
              "type": "array",
              "description": "Referenzen auf pv_systems[].id in components.json (Mehrfach-Auswahl).",
              "items": {
                "type": "string"
              }
            },
            "import_tariff_id": {
              "type": "string",
              "description": "Referenz auf import_tariffs[].id in tariffs.json, oder reserved id __user_fixed__ für szenario-lokalen Festpreis."
            },
            "export_tariff_id": {
              "type": "string",
              "description": "Referenz auf export_tariffs[].id in tariffs.json, oder reserved id __user_fixed__ für szenario-lokalen Festpreis."
            },
            "user_import_cent_kwh": {
              "type": "number",
              "exclusiveMinimum": 0,
              "description": "Nur bei import_tariff_id=__user_fixed__: Lieferanten-Arbeitspreis Cent/kWh inkl. USt (nicht in tariffs.json)."
            },
            "user_export_cent_kwh": {
              "type": "number",
              "minimum": 0,
              "description": "Nur bei export_tariff_id=__user_fixed__: Einspeisevergütung Cent/kWh (nicht in tariffs.json)."
            },
            "house_profile_id": {
              "type": "string",
              "description": "Referenz auf profiles[].id in house_profiles.json."
            },
            "use_imported_pv": {
              "type": "boolean",
              "description": "Wenn true: Szenario-Explorer nutzt Hausprofil-pv_profile_csv statt PV aus Wetterdaten (Open-Meteo)."
            },
            "pv_tilt": {
              "type": "number"
            },
            "pv_azimuth": {
              "type": "number"
            },
            "pv_kwp": {
              "type": "number"
            },
            "battery_max_power_kw": {
              "type": "number",
              "description": "Deprecated (2.7.j): single max for both directions; prefer charge/discharge fields."
            },
            "battery_max_charge_power_kw": {
              "type": "number",
              "description": "Max charge power (kW). Prefer over battery_max_power_kw."
            },
            "battery_max_discharge_power_kw": {
              "type": "number",
              "description": "Max discharge power (kW). Prefer over battery_max_power_kw."
            },
            "limits_from_live": {
              "type": "boolean",
              "description": "When true, live get_ess_* telemetry overrides HK SOC/power ceilings."
            },
            "control": {
              "type": "string",
              "enum": ["full", "limits_only", "read_only"],
              "description": "Battery controllability (same as components.json batteries[].control)."
            },
            "standby_power_kw": {
              "type": "number",
              "minimum": 0,
              "description": "Dauerhafte AC-Eigenleistung der Batterie (kW)."
            },
            "battery_efficiency": {
              "type": "number",
              "exclusiveMinimum": 0,
              "maximum": 1,
              "description": "One-way chemistry η_batt when overriding components; path = η_inv · η_batt."
            },
            "battery_capacity_kwh": {
              "type": "number"
            },
            "battery_min_soc": {
              "type": "number"
            },
            "battery_max_soc": {
              "type": "number"
            },
            "threshold_power": {
              "type": "number"
            }
          }
        }
      }
    }
  }
}
