{
    "$schema": "./backtesting_scenarios.schema.json",
    "earnie_data_model": 5,
    "cbc_gap_rel": 0.1,
    "commit_hours": 24,
    "cbc_strict_time_limit_sec": 3,
    "scenarios": [
        {
            "id": "live",
            "label": "Live",
            "settings": {
                "battery_ids": [
                    "default_5kwh"
                ],
                "pv_system_ids": [
                    "roof_south"
                ],
                "import_tariff_id": "awattar_at",
                "export_tariff_id": "at_verbund_v_strom_sonneneinspeisung_fix",
                "house_profile_id": "example_efh"
            }
        },
        {
            "id": "battery_5kwh_dynamic",
            "label": "5 kWh, dynamische Einspeise",
            "settings": {
                "import_tariff_id": "awattar_at",
                "export_tariff_id": "dynamic_epex",
                "pv_tilt": 25,
                "pv_azimuth": 0,
                "pv_kwp": 10,
                "battery_max_charge_power_kw": 2.5,
                "battery_max_discharge_power_kw": 2.5,
                "battery_efficiency": 0.97,
                "battery_capacity_kwh": 5.0,
                "battery_min_soc": 10.0,
                "battery_max_soc": 100.0,
                "threshold_power": 0.02,
                "limits_from_live": false,
                "control": "full"
            }
        },
        {
            "id": "battery_10kwh_fixed",
            "label": "10 kWh, fixe Einspeise",
            "settings": {
                "import_tariff_id": "awattar_at",
                "export_tariff_id": "__user_fixed__",
                "user_export_cent_kwh": 3.7,
                "pv_tilt": 25,
                "pv_azimuth": 0,
                "pv_kwp": 10,
                "battery_max_charge_power_kw": 5.0,
                "battery_max_discharge_power_kw": 5.0,
                "battery_efficiency": 0.97,
                "battery_capacity_kwh": 10.0,
                "battery_min_soc": 10.0,
                "battery_max_soc": 100.0,
                "threshold_power": 0.02,
                "limits_from_live": false,
                "control": "full"
            }
        },
        {
            "id": "battery_10kwh_dynamic",
            "label": "10 kWh, dynamische Einspeise",
            "settings": {
                "import_tariff_id": "awattar_at",
                "export_tariff_id": "dynamic_epex",
                "pv_tilt": 25,
                "pv_azimuth": 0,
                "pv_kwp": 10,
                "battery_max_charge_power_kw": 5.0,
                "battery_max_discharge_power_kw": 5.0,
                "battery_efficiency": 0.97,
                "battery_capacity_kwh": 10.0,
                "battery_min_soc": 10.0,
                "battery_max_soc": 100.0,
                "threshold_power": 0.02,
                "limits_from_live": false,
                "control": "full"
            }
        },
        {
            "id": "entity_refs_planning",
            "label": "10 kWh + monatliche Einspeise (Entitäten-Referenzen)",
            "settings": {
                "battery_ids": [
                    "upgrade_10kwh"
                ],
                "pv_system_ids": [
                    "roof_south"
                ],
                "import_tariff_id": "awattar_at",
                "export_tariff_id": "monthly_sunny_web_recherche",
                "house_profile_id": "example_efh"
            }
        }
    ]
}
