{
    "cbc_gap_rel": 0.1,
    "commit_hours": 24,
    "cbc_strict_time_limit_sec": 3,
    "scenarios": [
        {
            "id": "live",
            "label": "Live",
            "settings": {
                "battery_ids": [
                    "test_battery"
                ],
                "pv_system_ids": [
                    "test_pv"
                ],
                "import_tariff_id": "fixed_25ct",
                "export_tariff_id": "fixed_37ct",
                "house_profile_id": "test_home"
            }
        },
        {
            "id": "fixture_5kwh_fixed",
            "label": "Fixture 5 kWh fixe Einspeise",
            "settings": {
                "k_push_cent": 3.5,
                "feed_in_mode": "fixed",
                "pv_tilt": 18,
                "pv_azimuth": 28,
                "pv_kwp": 6.0,
                "battery_max_power_kw": 2.5,
                "battery_efficiency": 0.95,
                "battery_capacity_kwh": 5.0,
                "battery_min_soc": 10.0,
                "battery_max_soc": 100.0,
                "threshold_power": 0.02,
                "latitude": 47.404,
                "longitude": 9.743,
                "timezone_name": "Europe/Vienna"
            }
        },
        {
            "id": "entity_test",
            "label": "Entitäten-Referenzen Test",
            "settings": {
                "battery_ids": [
                    "test_battery"
                ],
                "pv_system_ids": [
                    "test_pv"
                ],
                "export_tariff_id": "monthly_test",
                "house_profile_id": "test_home"
            }
        }
    ],
    "earnie_data_model": 5
}
