{
    "$schema": "./backtesting_scenarios.schema.json",
    "earnie_data_model": 5,
    "cbc_gap_rel": 0.1,
    "commit_hours": 24,
    "cbc_strict_time_limit_sec": 3,
    "scenarios": [
        {
            "id": "live",
            "label": "Live",
            "settings": {
                "battery_ids": [],
                "pv_system_ids": [],
                "import_tariff_id": "",
                "export_tariff_id": "",
                "house_profile_id": ""
            }
        }
    ]
}
